{
  "$schema": "idlewuxia.workspace_hygiene_manifest.v1",
  "projectId": "idlewuxia",
  "authorityRoot": "H:/MyProjectBack/idlewuxia",
  "migrationMode": "manifest_only_no_file_moves",
  "activeAuthority": {
    "source": "config/project_scope.json#shippingFiles",
    "entry": "src/wuxia-main.js",
    "description": "Only the exact shipping closure is executable product authority."
  },
  "dormantLegacy": {
    "policy": "tracked_read_only_not_importable_by_active_runtime_not_shipping",
    "description": "Inherited Idle Dot Shooter/Nova Lite source, configuration and its diagnostic tools remain historical development material.",
    "exactFiles": [
      "src/main.js",
      "src/DemoDirector.js",
      "src/contracts.ts",
      "src/legacy-shooting.css",
      "src/firstSessionCombatFlow.js",
      "src/combatPresentationAudit.js",
      "src/combatReadability.js",
      "src/runtimeCombatAudit.js",
      "src/monetizationContractAudit.js",
      "src/unlockGates.js",
      "config/acceptance_gates_p0d.json",
      "config/ad_demo_timelines.json",
      "config/ads_iap_guardrails.json",
      "config/boss_nova_reactor.json",
      "config/boss_templates.json",
      "config/combat_feedback.json",
      "config/enemies.json",
      "config/iap_product_catalog.json",
      "config/monetization_backend_contract.json",
      "config/optimized_balance_overlay.p0e.json",
      "config/original_boss_rewards.json",
      "config/original_boss_scaling.json",
      "config/original_economy_constants.json",
      "config/original_ui_unlocks.json",
      "config/original_world_scaling.json",
      "config/original_world_ui_attributes.json",
      "config/presentation_runtime_tuning.json",
      "config/skins.json",
      "config/theme_semantic_contract.json",
      "config/ui_progression_catalog.json",
      "config/ui_shell_contract.json",
      "config/vfx_recipes.json",
      "config/visual_style_contract.json",
      "config/wave_templates.json",
      "config/weapon_runtime_tuning.json",
      "config/worlds_patch.json",
      "tools/run-sim.mjs",
      "tools/validate-config.mjs",
      "tools/validate-unlock-gates.mjs",
      "tools/validate-combat-readability.mjs",
      "tools/validate-combat-presentation-audit.mjs",
      "tools/validate-presentation-config.mjs",
      "tools/validate-combat-mechanics-parity.mjs",
      "tools/validate-mobile-shell.mjs",
      "tools/audit-p1p2-open-items.mjs",
      "tools/audit-main-function-parity.mjs",
      "tools/validate-monetization-contract.mjs",
      "tools/validate-runtime-combat-audit.mjs",
      "tools/validate-runtime-combat-capture.mjs",
      "tools/generate-original-parity-audit.mjs"
    ]
  },
  "referenceOnly": {
    "policy": "development_evidence_not_shipping",
    "description": "Competitor/original-project evidence and development overlays may inform configuration but their bytes cannot enter the shipping closure.",
    "exactFiles": [
      "config/fangzhijianghu_ingestion_manifest.json",
      "config/wuxia_competitor_first_session_reference.json",
      "config/wuxia_combat_reference_asset_overlay.json",
      "config/wuxia_combat_reference_asset_overlay.schema.json",
      "tools/audit-fangzhijianghu-sources.mjs",
      "tools/audit-reference-consistency.mjs",
      "tools/validate-reference-parity.mjs",
      "tools/audit-wuxia-vs-fzjh-flow-parity.mjs",
      "tools/run-wuxia-combat-reference-binding-acceptance.mjs",
      "tools/validate-wuxia-combat-reference-asset-overlay.mjs",
      "tools/test-wuxia-combat-reference-asset-overlay.mjs",
      "docs/COMBAT_REFERENCE_ASSET_DEVELOPMENT_OVERLAY_20260807.md",
      "docs/codex_game_development_os/REFERENCE_ADOPTION_AND_ASSET_PROVENANCE.md",
      "docs/codex_game_development_os/ASSET_011_ORIGINAL_PROJECT_DEVELOPMENT_BINDING_20260809.md",
      "docs/codex_game_development_os/COMBAT_002B_ORIGINAL_PROJECT_DEVELOPMENT_BINDING_20260809.md"
    ]
  },
  "sharedGovernance": {
    "policy": "tracked_remainder_after_exact_exclusions",
    "description": "Build, Android, tests, schemas, tools and documentation that govern the active project without becoming browser shipping bytes."
  },
  "safety": {
    "forbidPhysicalMoves": true,
    "forbidPermanentDeletion": true,
    "requireHashManifestForFutureMove": true,
    "requiredTemporaryRoot": ".codex-os/temp/",
    "rollback": "Revert the manifest/tooling commit; no product or evidence file was moved."
  }
}
